A1: Graph of CO2 emissions in Latin America and the Caribbean
A3: Countries | B3: MtCO2 Total
A4: Mexico | B4: 477
A5: Brazil | B5: 457
A6: Argentina | B6: 196
A7: Venezuela | B7: 139
A8: Colombia | B8: 97
A9: Chile | B9: 86
A10: Peru | B10: 56
A11: Trinidad and Tobago | B11: 44
A12: Ecuador | B12: 42
A13: Cuba | B13: 29
A14: Dominican Republic | B14: 25
A15: Bolivia | B15: 22
A16: Guatemala | B16: 18
A17: Panama | B17: 11
A18: Honduras | B18: 9.9
A19: Jamaica | B19: 8.2
A20: Costa Rica | B20: 8.1
A21: Paraguay | B21: 7.4
A22: El Salvador | B22: 7.1
A23: Uruguay | B23: 6.9
A24: Nicaragua | B24: 5.6
A25: Total general | B25: 1752.2
B27: Country | C27: MtCo2
B28: Mexico | C28: =GETPIVOTDATA("MtCO2",$A$5,"Paises con mayor emision de CO2","Mexico") -> 477
B29: Brazil | C29: =GETPIVOTDATA("MtCO2",$A$5,"Paises con mayor emision de CO2","Brazil") -> 457
B30: Argentina | C30: =GETPIVOTDATA("MtCO2",$A$5,"Paises con mayor emision de CO2","Argentina") -> 196
B31: Venezuela | C31: =GETPIVOTDATA("MtCO2",$A$5,"Paises con mayor emision de CO2","Venezuela") -> 139
B32: Colombia | C32: =GETPIVOTDATA("MtCO2",$A$5,"Paises con mayor emision de CO2","Colombia") -> 97
B33: Chile | C33: =GETPIVOTDATA("MtCO2",$A$5,"Paises con mayor emision de CO2","Chile") -> 86
B34: Peru | C34: =GETPIVOTDATA("MtCO2",$A$5,"Paises con mayor emision de CO2","Peru") -> 56
B35: Trinidad and Tobago | C35: =GETPIVOTDATA("MtCO2",$A$5,"Paises con mayor emision de CO2","Trinidad and Tobago") -> 44
B36: Ecuador | C36: =GETPIVOTDATA("MtCO2",$A$5,"Paises con mayor emision de CO2","Ecuador") -> 42
B37: Cuba | C37: =GETPIVOTDATA("MtCO2",$A$5,"Paises con mayor emision de CO2","Cuba ") -> 29
B38: Dominican Republic | C38: =GETPIVOTDATA("MtCO2",$A$5,"Paises con mayor emision de CO2","Dominican Republic") -> 25
B39: Bolivia | C39: =GETPIVOTDATA("MtCO2",$A$5,"Paises con mayor emision de CO2","Bolivia") -> 22
B40: Guatemala | C40: =GETPIVOTDATA("MtCO2",$A$5,"Paises con mayor emision de CO2","Guatemala") -> 18
B41: Panama | C41: =GETPIVOTDATA("MtCO2",$A$5,"Paises con mayor emision de CO2","Panama") -> 11
B42: Honduras | C42: =GETPIVOTDATA("MtCO2",$A$5,"Paises con mayor emision de CO2","Honduras") -> 9.9
B43: Jamaica | C43: =GETPIVOTDATA("MtCO2",$A$5,"Paises con mayor emision de CO2","Jamaica") -> 8.2
B44: Costa Rica | C44: =GETPIVOTDATA("MtCO2",$A$5,"Paises con mayor emision de CO2","Costa Rica") -> 8.1
B45: Paraguay | C45: =GETPIVOTDATA("MtCO2",$A$5,"Paises con mayor emision de CO2","Paraguay") -> 7.4
B46: El Salvador | C46: =GETPIVOTDATA("MtCO2",$A$5,"Paises con mayor emision de CO2","El Salvador") -> 7.1
B47: Uruguay | C47: =GETPIVOTDATA("MtCO2",$A$5,"Paises con mayor emision de CO2","Uruguay") -> 6.9
B48: Nicaragua | C48: =GETPIVOTDATA("MtCO2",$A$5,"Paises con mayor emision de CO2","Nicaragua") -> 5.6
A52: Country | B52: Total MtCo2 | C52: MtCo2 Total Reduction
A53: Mexico | B53: 477 | C53: 357.75
A54: Brazil | B54: 457 | C54: 342.75
A55: Argentina | B55: 196 | C55: 147
A56: Venezuela | B56: 139 | C56: 104.25
A57: Colombia | B57: 97 | C57: 72.75
A58: Chile | B58: 86 | C58: 64.5
A59: Peru | B59: 56 | C59: 42
A60: Trinidad and Tobago | B60: 44 | C60: 33
A61: Ecuador | B61: 42 | C61: 31.5
A62: Cuba | B62: 29 | C62: 21.75
A63: Dominican Republic | B63: 25 | C63: 18.75
A64: Bolivia | B64: 22 | C64: 16.5
A65: Guatemala | B65: 18 | C65: 13.5
A66: Panama | B66: 11 | C66: 8.25
A67: Honduras | B67: 9.9 | C67: 7.425
A68: Jamaica | B68: 8.2 | C68: 6.15
A69: Costa Rica | B69: 8.1 | C69: 6.075
A70: Paraguay | B70: 7.4 | C70: 5.55
A71: El Salvador | B71: 7.1 | C71: 5.325
A72: Uruguay | B72: 6.9 | C72: 5.175
A73: Nicaragua | B73: 5.6 | C73: 4.2
A74: Total general | B74: 1752.2 | C74: 1314.15