A1: Countries with the highest CO2 emissions | B1: MtCO2 | E1: Country | F1: Reduction by Covid-19 | G1: MtCo2 | H1: Total Reduction
A2: China | B2: 10065 | E2: China | F2: 0.25 | G2: 10065 | H2: =G2-(G2*F2) -> 7548.75
A3: United States | B3: 5416 | E3: United States | F3: 0.25 | G3: 5416 | H3: =G3-(G3*F3) -> 4062
A4: India | B4: 2654 | E4: India | F4: 0.25 | G4: 2654 | H4: =G4-(G4*F4) -> 1990.5
A5: Russian Federation | B5: 1711 | E5: Russian Federation | F5: 0.25 | G5: 1711 | H5: =G5-(G5*F5) -> 1283.25
A6: Japan | B6: 1162 | E6: Japan | F6: 0.25 | G6: 1162 | H6: =G6-(G6*F6) -> 871.5
A7: Germany | B7: 759 | E7: Germany | F7: 0.25 | G7: 759 | H7: =G7-(G7*F7) -> 569.25
A8: Iran | B8: 720 | E8: Iran | F8: 0.25 | G8: 720 | H8: =G8-(G8*F8) -> 540
A9: South Korea | B9: 659 | E9: South Korea | F9: 0.25 | G9: 659 | H9: =G9-(G9*F9) -> 494.25
A10: Saudi Arabia | B10: 621 | E10: Saudi Arabia | F10: 0.25 | G10: 621 | H10: =G10-(G10*F10) -> 465.75
A11: Indonesia | B11: 615 | E11: Indonesia | F11: 0.25 | G11: 615 | H11: =G11-(G11*F11) -> 461.25
A12: Canada | B12: 568 | E12: Canada | F12: 0.25 | G12: 568 | H12: =G12-(G12*F12) -> 426
A13: Mexico | B13: 477 | E13: Mexico | F13: 0.25 | G13: 477 | H13: =G13-(G13*F13) -> 357.75
A14: South Africa | B14: 468 | E14: South Africa | F14: 0.25 | G14: 468 | H14: =G14-(G14*F14) -> 351
A15: Brazil | B15: 457 | E15: Brazil | F15: 0.25 | G15: 457 | H15: =G15-(G15*F15) -> 342.75
A16: Turkey | B16: 428 | E16: Turkey | F16: 0.25 | G16: 428 | H16: =G16-(G16*F16) -> 321
A17: Australia | B17: 420 | E17: Australia | F17: 0.25 | G17: 420 | H17: =G17-(G17*F17) -> 315
A18: United Kingdom | B18: 379 | E18: United Kingdom | F18: 0.25 | G18: 379 | H18: =G18-(G18*F18) -> 284.25
A19: Poland | B19: 344 | E19: Poland | F19: 0.25 | G19: 344 | H19: =G19-(G19*F19) -> 258
A20: Italy | B20: 338 | E20: Italy | F20: 0.25 | G20: 338 | H20: =G20-(G20*F20) -> 253.5
A21: France | B21: 338 | E21: France | F21: 0.25 | G21: 338 | H21: =G21-(G21*F21) -> 253.5
A22: Thailand | B22: 288 | E22: Thailand | F22: 0.25 | G22: 288 | H22: =G22-(G22*F22) -> 216