A1: Countries with the highest CO2 emissions | B1: MtCO2 | E1: Country | F1: Reduction by Covid-19 | G1: MtCo2 | H1: Total Reduction
A2: Mexico | B2: 477 | E2: Mexico | F2: 0.25 | G2: 477 | H2: =G2-(G2*F2) -> 357.75
A3: Brazil | B3: 457 | E3: Brazil | F3: 0.25 | G3: 457 | H3: =G3-(G3*F3) -> 342.75
A4: Argentina | B4: 196 | E4: Argentina | F4: 0.25 | G4: 196 | H4: =G4-(G4*F4) -> 147
A5: Venezuela | B5: 139 | E5: Venezuela | F5: 0.25 | G5: 139 | H5: =G5-(G5*F5) -> 104.25
A6: Colombia | B6: 97 | E6: Colombia | F6: 0.25 | G6: 97 | H6: =G6-(G6*F6) -> 72.75
A7: Chile | B7: 86 | E7: Chile | F7: 0.25 | G7: 86 | H7: =G7-(G7*F7) -> 64.5
A8: Peru | B8: 56 | E8: Peru | F8: 0.25 | G8: 56 | H8: =G8-(G8*F8) -> 42
A9: Trinidad and Tobago | B9: 44 | E9: Trinidad and Tobago | F9: 0.25 | G9: 44 | H9: =G9-(G9*F9) -> 33
A10: Ecuador | B10: 42 | E10: Ecuador | F10: 0.25 | G10: 42 | H10: =G10-(G10*F10) -> 31.5
A11: Cuba | B11: 29 | E11: Cuba | F11: 0.25 | G11: 29 | H11: =G11-(G11*F11) -> 21.75
A12: Dominican Republic | B12: 25 | E12: Dominican Republic | F12: 0.25 | G12: 25 | H12: =G12-(G12*F12) -> 18.75
A13: Bolivia | B13: 22 | E13: Bolivia | F13: 0.25 | G13: 22 | H13: =G13-(G13*F13) -> 16.5
A14: Guatemala | B14: 18 | E14: Guatemala | F14: 0.25 | G14: 18 | H14: =G14-(G14*F14) -> 13.5
A15: Panama | B15: 11 | E15: Panama | F15: 0.25 | G15: 11 | H15: =G15-(G15*F15) -> 8.25
A16: Honduras | B16: 9.9 | E16: Honduras | F16: 0.25 | G16: 9.9 | H16: =G16-(G16*F16) -> 7.425
A17: Jamaica | B17: 8.2 | E17: Jamaica | F17: 0.25 | G17: 8.2 | H17: =G17-(G17*F17) -> 6.15
A18: Costa Rica | B18: 8.1 | E18: Costa Rica | F18: 0.25 | G18: 8.1 | H18: =G18-(G18*F18) -> 6.075
A19: Paraguay | B19: 7.4 | E19: Paraguay | F19: 0.25 | G19: 7.4 | H19: =G19-(G19*F19) -> 5.55
A20: El Salvador | B20: 7.1 | E20: El Salvador | F20: 0.25 | G20: 7.1 | H20: =G20-(G20*F20) -> 5.325
A21: Uruguay | B21: 6.9 | E21: Uruguay | F21: 0.25 | G21: 6.9 | H21: =G21-(G21*F21) -> 5.175
A22: Nicaragua | B22: 5.6 | E22: Nicaragua | F22: 0.25 | G22: 5.6 | H22: =G22-(G22*F22) -> 4.2