A1: Graph of CO2 emissions worldwide
A3: Countries | B3: MTCO2 Total
A4: China | B4: 10065
A5: United States | B5: 5416
A6: India | B6: 2654
A7: Russian Federation | B7: 1711
A8: Japan | B8: 1162
A9: Germany | B9: 759
A10: Iran | B10: 720
A11: South Korea | B11: 659
A12: Saudi Arabia | B12: 621
A13: Indonesia | B13: 615
A14: Canada | B14: 568
A15: Mexico | B15: 477
A16: South Africa | B16: 468
A17: Brazil | B17: 457
A18: Turkey | B18: 428
A19: Australia | B19: 420
A20: United Kingdom | B20: 379
A21: Poland | B21: 344
A22: Italy | B22: 338
A23: France | B23: 338
A24: Thailand | B24: 288
A25: Total general | B25: 28887
B27: Country | C27: MtCo2
B28: China | C28: =GETPIVOTDATA("MtCO2",$A$5,"Paises con mayor emision de CO2","China") -> 10065
B29: United States | C29: =GETPIVOTDATA("MtCO2",$A$5,"Paises con mayor emision de CO2","United States") -> 5416
B30: India | C30: =GETPIVOTDATA("MtCO2",$A$5,"Paises con mayor emision de CO2","India") -> 2654
B31: Russian Federation | C31: =GETPIVOTDATA("MtCO2",$A$5,"Paises con mayor emision de CO2","Russian Federation") -> 1711
B32: Japan | C32: =GETPIVOTDATA("MtCO2",$A$5,"Paises con mayor emision de CO2","Japan") -> 1162
B33: Germany | C33: =GETPIVOTDATA("MtCO2",$A$5,"Paises con mayor emision de CO2","Germany") -> 759
B34: Iran | C34: =GETPIVOTDATA("MtCO2",$A$5,"Paises con mayor emision de CO2","Iran") -> 720
B35: South Korea | C35: =GETPIVOTDATA("MtCO2",$A$5,"Paises con mayor emision de CO2","South Korea") -> 659
B36: Saudi Arabia | C36: =GETPIVOTDATA("MtCO2",$A$5,"Paises con mayor emision de CO2","Saudi Arabia") -> 621
B37: Indonesia | C37: =GETPIVOTDATA("MtCO2",$A$5,"Paises con mayor emision de CO2","Indonesia") -> 615
B38: Canada | C38: =GETPIVOTDATA("MtCO2",$A$5,"Paises con mayor emision de CO2","Canada") -> 568
B39: Mexico | C39: =GETPIVOTDATA("MtCO2",$A$5,"Paises con mayor emision de CO2","Mexico") -> 477
B40: South Africa | C40: =GETPIVOTDATA("MtCO2",$A$5,"Paises con mayor emision de CO2","South Africa") -> 468
B41: Brazil | C41: =GETPIVOTDATA("MtCO2",$A$5,"Paises con mayor emision de CO2","Brazil ") -> 457
B42: Turkey | C42: =GETPIVOTDATA("MtCO2",$A$5,"Paises con mayor emision de CO2","Turkey") -> 428
B43: Australia | C43: =GETPIVOTDATA("MtCO2",$A$5,"Paises con mayor emision de CO2","Australia") -> 420
B44: United Kingdom | C44: =GETPIVOTDATA("MtCO2",$A$5,"Paises con mayor emision de CO2","United Kingdom") -> 379
B45: Poland | C45: =GETPIVOTDATA("MtCO2",$A$5,"Paises con mayor emision de CO2","Poland") -> 344
B46: Italy | C46: =GETPIVOTDATA("MtCO2",$A$5,"Paises con mayor emision de CO2","Italy") -> 338
B47: France | C47: =GETPIVOTDATA("MtCO2",$A$5,"Paises con mayor emision de CO2","France") -> 338
B48: Thailand | C48: =GETPIVOTDATA("MtCO2",$A$5,"Paises con mayor emision de CO2","Thailand") -> 288
A52: Country | B52: Total MtCo2 | C52: MtCo2 Total Reduction
A53: China | B53: 10065 | C53: 7548.75
A54: United States | B54: 5416 | C54: 4062
A55: India | B55: 2654 | C55: 1990.5
A56: Russian Federation | B56: 1711 | C56: 1283.25
A57: Japan | B57: 1162 | C57: 871.5
A58: Germany | B58: 759 | C58: 569.25
A59: Iran | B59: 720 | C59: 540
A60: South Korea | B60: 659 | C60: 494.25
A61: Saudi Arabia | B61: 621 | C61: 465.75
A62: Indonesia | B62: 615 | C62: 461.25
A63: Canada | B63: 568 | C63: 426
A64: Mexico | B64: 477 | C64: 357.75
A65: South Africa | B65: 468 | C65: 351
A66: Brazil | B66: 457 | C66: 342.75
A67: Turkey | B67: 428 | C67: 321
A68: Australia | B68: 420 | C68: 315
A69: United Kingdom | B69: 379 | C69: 284.25
A70: Poland | B70: 344 | C70: 258
A71: Italy | B71: 338 | C71: 253.5
A72: France | B72: 338 | C72: 253.5
A73: Thailand | B73: 288 | C73: 216
A74: Total general | B74: 28887 | C74: 21665.25